URLs,Arabic Title,Arabic Desc,PR Status
perfumes-edt-edp,اشتري ارقى  تشكيلة من العطور النسائية عبر الإنترنت في الإمارات العربية المتحدة بأفضل الأسعار | نساء,اكتشفي سحر العطور النسائية عبر الإنترنت في نساء الإمارات . تسوقي عبر الإنترنت أفضل تشكيلة من العطور وماء التواليت ومزيلات العرق ومعطرات الجسم المصنوعة للنساء من أشهر العلامات التجارية. استمتعي بأفضل الصفقات والعروض.,Not Done
body-mist-spray,اشتري أفضل تشكيلة من العطور النسائية عبر الإنترنت بأفضل الأسعار في الإمارات العربية المتحدة | نساء,انغمسي في سحر العطور النسائية عبر الإنترنت مع نساء. اختاري من بين تشكيلة متنوعة من أفخر العطور وماء التواليت عبر الإنترنت وارتقي بذوقك الشخصي. تسوقي عبر الإنترنت اليوم واستمتعي بعروض مذهلة.,Not Done
deodorants-roll-ons,اشتري أفضل معطرات الجسم ومزيلات العرق للنساء عبر الإنترنت في الإمارات العربية المتحدة بأفضل الأسعار | نساء,جددي نشاطك مع مزيلات العرق المنعشة عبر الإنترنت مع نساء. مثالية لإضفاء لمسة خفيفة ورائحة عطرة على مدار اليوم. تسوقي الآن واختاري أرقى منتجات العلامات التجارية الشهيرة عالمياً.,Not Done
hair-mist,اشتري مزيلات العرق والرول اونز للنساء عبر الإنترنت بأفضل الأسعار | نساء الإمارات ,حافظي على انتعاشك طوال اليوم مع مزيلات العرق والرول اونز. تسوقي عبر الإنترنت مع نساء للحصول على منتجات عطرية فعالة وطويلة الأمد. اختاري الأفضل من بين أرقى منتجات أشهر العلامات التجارية.,Not Done
men,اشتري ارقى  تشكيلة من معطرات الشعر النسائية عبر الإنترنت في الإمارات العربية المتحدة بأفضل الأسعار بأفضل الأسعار | نساء,أضيفي لمسة عطرية إلى شعرك مع معطرات الشعر عبر الإنترنت لدى نساء. مثالية للحصول على عطر خفيف ودائم على خصلات شعرك. تسوقي معطرات الشعر عبر الإنترنت اليوم.,Not Done
men-perfumes-edt-edp,اشترِ ارقى  تشكيلة من العطور الرجالية عبر الإنترنت في الإمارات العربية المتحدة بأفضل الأسعار | نساء,استكشف سحر العطور الرجالية عبر الإنترنت في نساء الإمارات . اختر من بين تشكيلة راقية من العطور الفواحة وماء التواليت المنعش لأشهر العلامات التجارية واحصل على خصومات مذهلة. تسوق الآن!,Not Done
giftsets-combos,اشتري أفضل تشكيلة من العطور الرجالية عبر الإنترنت بأفضل الأسعار في الإمارات العربية المتحدة | نساء,اختر من بين تشكيلة حصرية من العطور الرجالية عبر الإنترنت لدى نساء. تسوق أرقى العطور وماء التواليت لتضفي على نفسك لمسة من الرقي والأناقة. احصل على عروض وخصومات رائعة.,Not Done
luxe-fragrance,اشتري مجموعات هدايا العطور والروائح عبر الإنترنت من نساء الإمارات ,اعثر على الهدية المثالية مع مجموعات الهدايا العطرية والروائح عبر الإنترنت في نساء الإمارات . مثالية للمناسبات الخاصة وإسعاد احبائك. تسوق منتجات عالية الجودة الآن بأسعار لا تقبل المنافسة.,Not Done
combos-at-nysaa-1,تشكيلة عطور | روائح فاخرة من نساء الإمارات ,اكتشف تشكلية عطور نساء الراقية، التي تتميز بروائح فاخرة مصممة للأناقة والرقي. تسوق عبر الإنترنت الآن للحصول على عطور تدوم طويلًا.,Not Done
gifts-at-nysaa,تشكيلات العطور لدى نيسا | أفضل عروض العطور | الإمارات العربية المتحدة,استكشف تشكيلات العطور الحصرية عبر الإنترنت في الإمارات العربية المتحدة لدى نساء. احصل على أفضل العروض على أرقى تشكيلات العطور المثالية للإهداء أو للاستخدام الشخصي.,Not Done
skincare,عطور الهدايا من نساء| هدايا العطور المثالية | الإمارات العربية المتحدة,اعثر على الهدية المثالية مع تشكلية عطور نساء الراقية. تقدم مجموعتنا المختارة أفضل الروائح العطرية لكل مناسبة. تسوق الآن واستمتع بشحن مجاني في جميع أنحاء الإمارات العربية المتحدة.,Not Done
moisturizers,اشتري منتجات العناية بالبشرة عبر الإنترنت في الإمارات العربية المتحدة | نساء,هل تبحثين عن أفضل منتجات العناية بالبشرة عبر الإنترنت في الإمارات العربية المتحدة؟ تصفّحي مجموعتنا الواسعة من منتجات العناية بالبشرة مثل غسول الوجه وسيروم الوجه وأقنعة الوجه والمزيد من نساء. اشتري الآن!,Not Done
face-moisturizer-day-cream,تسوقي أجود مرطبات البشرة عبر الإنترنت بأفضل الأسعار في الإمارات العربية المتحدة | نساء,تسوقي أفضل منتجات ترطيب البشرة عبر الإنترنت من نساء. اختاري من بين أجود أنواع مرطبات البشرة واحصلي على ما يناسب جميع أنواع البشرة. اطلبيها الآن!,Not Done
body-sunscreen,اشتري مستحضرات ومنتجات التجميل عبر الإنترنت في الإمارات العربية المتحدة بأفضل الأسعار | نساء,تسوقي أفضل مستحضرات التجميل ومنتجات التجميل عبر الإنترنت من نساء، متجر الجمال الإلكتروني. تصفحي مستحضرات التجميل ومنتجات العناية بالبشرة والشعر والمزيد من أفضل العلامات التجارية في مجال التجميل.,Not Done
face-oils,اشتري منتجات الوقاية من الشمس للجسم عبر الإنترنت في الإمارات العربية المتحدة على نساء,احمي بشرتك باستخدام واقيات الشمس من نساء. تسوقي الآن للحصول على واقيات شمسية عالية الجودة عبر الإنترنت بأسعار مغرية. لا تفوّتي عروضنا!,Not Done
treatments,تسوقي زيوت الوجه عبر الإنترنت في الإمارات العربية المتحدة بأفضل الأسعار | نساء,اشتري زيوت الوجه الفاخرة من نساء عبر الإنترنت للحصول على ترطيب عميق وإشراقة متألقة. اطلبي زيوت الوجه الآن للحصول على بشرة متوهجة.,Not Done
face-serums,تسوقي منتجات العناية بالبشرة الأعلى تقييماً عبر الإنترنت | نساء الإمارات ,اشتري أفضل منتجات العناية بالبشرة المتخصصة من نساء بأفضل الأسعار. تشكيلتنا الواسعة من منتجات العناية بالبشرة المتخصصة المناسبة لجميع أنواع البشرة! اطلبي الآن.,Not Done
blemish-acne-treatments,تسوقي منتجات سيروم الوجه عبر الإنترنت في الإمارات العربية المتحدة بأفضل الأسعار | نساء,تسوقي أجود منتجات سيروم الوجه عبر الإنترنت: تسوقي من بين أكثر من 1000 منتج واختاري الخيار الأكثر ملائمة لبشرتك. تتوفر لدينا خدمة التوصيل المجاني!,Not Done
cleansers,تسوقي مجموعة مكافحة حب الشباب عبر الإنترنت في الإمارات العربية المتحدة بأفضل الأسعار,اشتري مجموعة أدوات مكافحة حب الشباب عبر الإنترنت: تسوقي من بين أكثر من 1000 منتج واختاري الخيار الأكثر ملائمة لبشرتك. تتوفر لدينا خدمة التوصيل المجاني!,Not Done
face-wash-cleanser,اشتري أفضل منتجات تنظيف البشرة عبر الإنترنت في الإمارات العربية المتحدة بأفضل الأسعار| نساء,جددي نشاط بشرتك مع منتجات نسا لتنظيف البشرة. تسوقي عبر الإنترنت للحصول على أفضل الأسعار واستمتعي بمظهر متألق لجميع أنواع البشرة.,Not Done
cleansing-oils-balm,اشتري أفضل منتجات غسول الوجه عبر الإنترنت في الإمارات العربية المتحدة بأفضل الأسعار | نساء,تسوقي أجود منتجات تنظيف الوجه من نساء بأفضل الأسعار عبر الإنترنت في الإمارات العربية المتحدة. ارتقي بمستوى العناية ببشرتك واحصلي على بشرة منتعشة ومشرقة. اشتري الآن!,Not Done
micellar-water,اشتري بلسم الزيوت المنظفة عبر الإنترنت في الإمارات العربية المتحدة بأفضل الأسعار | نساء,اكتشفي أفخم منتجات تنظيف البشرة مع نساء. تسوقي بلسم الزيت المنظف للبشرة عبر الإنترنت في الإمارات العربية المتحدة بأسعار لا تضاهى. ارتقي بروتينك اليومي للعناية ببشرتك. اشتري الآن!,Not Done
face-wipes,تسوقي مياه الميسيلار عبر الإنترنت في الإمارات العربية المتحدة بأفضل الأسعار | نساء,ارتقي بمستوى تنظيف بشرتك! تسوقي مياه الميسيلار من نسا عبر الإنترنت في الإمارات العربية المتحدة بأسعار لا تضاهى. أنعشي بشرتك دون عناء. اشتري الآن!,Not Done
scrubs-exfoliators,تسوقي مناديل الوجه عبر الإنترنت في الإمارات العربية المتحدة بأفضل الأسعار | نساء,جربي الراحة والانتعاش! تسوقي أجود مناديل الوجه للنساء عبر الإنترنت في الإمارات العربية المتحدة بأسعار لا تضاهى. عناية سريعة وسهلة وفعالة بالبشرة. اشتري الآن!,Not Done
masks,تسوقي مقشرات البشرة عبر الإنترنت في الإمارات العربية المتحدة بأفضل الأسعار | نساء,جددي نشاط بشرتك مع مقشرات البشرة من نساء عبر الإنترنت بأسعار مذهلة في الإمارات العربية المتحدة. ارتقي بروتينك اليومي للعناية ببشرتك. اشتري الآن للحصول على إشراقة متألقة!,Not Done
sheet-masks,اشتري أجود أنواع أقنعة الوجه عبر الإنترنت في الإمارات العربية المتحدة بأفضل الأسعار | نساء,هل تبحثين عن أقنعة الوجه عبر الإنترنت في الإمارات العربية المتحدة بأسعار لا تقبل المنافسة؟ اشتري الآن أجود أنواع أقنعة الوجه نساء للحصول على بشرة نضرة ومتوهجة!,Not Done
sleeping-masks,تسوقي أفضل أقنعة الوجه عبر الإنترنت في الإمارات العربية المتحدة بأفضل الأسعار | نساء,جددي نضارة بشرتك مع أقنعة الوجه من نساء عبر الإنترنت في الإمارات العربية المتحدة بأسعار لا تضاهى. ارتقي بمستوى تألقك. اشتري الآن!,Not Done
masks-peels,تسوقي أفضل أقنعة النوم عبر الإنترنت في الإمارات العربية المتحدة بأفضل الأسعار | نساء,جددي نشاط بشرتك أثناء النوم! تسوقي أقنعة النوم من نساء عبر الإنترنت في الإمارات العربية المتحدة بأسعار مذهلة. استيقظي على بشرة مشرقة. اشتري الآن!,Not Done
face-packs,تسوقي أجود أنواع أقنعة وتقشير البشرة عبر الإنترنت في الإمارات العربية المتحدة بأفضل الأسعار | نساء,احصلي على بشرة مشرقة! تسوقي أجود منتجات أقنعة ومقشرات البشرة من نساء عبر الإنترنت في الإمارات العربية المتحدة بأسعار لا تضاهى وارتقي بمستوى تألقك. اشتري الآن!,Not Done
eye-masks,تسوقي أفضل أقنعة الوجه عبر الإنترنت في الإمارات العربية المتحدة بأفضل الأسعار | نساء,ارتقي بطقوس العناية ببشرتك مع أقنعة الوجه من نساء عبر الإنترنت في الإمارات العربية المتحدة بأسعار مذهلة. جددي شباب بشرتك. تسوقي الآن للحصول على مظهر متألق!,Not Done
toners,تسوقي أفضل أقنعة العين عبر الإنترنت في الإمارات العربية المتحدة بأفضل الأسعار | نساء,أنعشي عينيك مع أقنعة العين من نساء عبر الإنترنت في الإمارات العربية المتحدة. احصلي على مظهر أكثر إشراقًا ونضارة. اشتري الآن لتجديد شبابك!,Not Done
toners-mists,اشتري تونر البشرة عبر الإنترنت في الإمارات العربية المتحدة بأفضل الأسعار | نساء,أطلقي العنان لبشرة مشرقة مع تونر البشرة من نساء عبر الإنترنت في الإمارات العربية المتحدة وارتقي بروتين العناية ببشرتك. اشتري الآن للحصول على بشرة متألقة!,Not Done
rose-water,اشتري بخاخ التونر للبشرة عبر الإنترنت في الإمارات العربية المتحدة بأفضل الأسعار | نساء,استمتعي بتجربة بخاخ التونر المنعش من نساء أونلاين في الإمارات العربية المتحدة وارتقي بروتين العناية ببشرتك. اشتري الآن للحصول على بشرة متألقة!,Not Done
body-care,اشتري ماء الورد عبر الإنترنت في الإمارات العربية المتحدة بأفضل الأسعار | نساء,انعشي بشرتك مع تونر ماء الورد من نساء. احصلي على أفضل منتجات ترطيب البشرة للحصول على بشرة متألقة ومشرقة. تسوقي عبر الإنترنت في الإمارات العربية المتحدة واحصلي على أفضل منتجات العناية بالبشرة الطبيعية بأسعار معقولة.,Not Done
lotions-creams,تسوقي منتجات العناية بالجسم عبر الإنترنت في الإمارات العربية المتحدة بأفضل الأسعار | نساء,دللي نفسك بالعناية الفاخرة بالجسم مع تشكيلة نساء للعناية بالجسم عبر الإنترنت من نساء في الإمارات العربية المتحدة بأفضل الأسعار. ارتقي بمستوى روتينك اليومي للعناية ببشرتك. اشتري الآن!,Not Done
body-butter,تسوقي لوشن الجسم عبر الإنترنت في الإمارات العربية المتحدة بأفضل الأسعار | نساء,غذي بشرتك مع مستحضرات وكريمات نساء عبر الإنترنت في الإمارات العربية المتحدة وارتقي بروتين العناية ببشرتك. اشتري الآن للحصول على توهج ناعم ومشرق!,Not Done
massage-oils,اشتري زبدة الجسم الفاخرة عبر الإنترنت بأفضل الأسعار في الإمارات العربية المتحدة | نساء,اكتشفي تشكيلة متميزة من منتجات زبدة الجسم عبر الإنترنت في نساء الإمارات . اطلبي الآن واستفيدي من العروض والصفقات الرائعة.,Not Done
shower-gels-body-wash,تسوقي أجود أنواع زيوت التدليك عبر الإنترنت في الإمارات العربية المتحدة بأفضل الأسعار | نساء,استرخي وجددي شبابك مع زيوت التدليك من نساء عبر الإنترنت في الإمارات العربية المتحدة وارتقي بروتينك اليومي للعناية ببشرتك. اشتري الآن لتجربة مريحة.,Not Done
soaps,اشتري أفضل منتجات غسول الجسم وجل الاستحمام عبر الإنترنت بأفضل الأسعار في الإمارات العربية المتحدة | نساء,اكتشفي تشكيلة متميزة من غسول الجسم وجل الاستحمام عبر الإنترنت لدى نساء الإمارات . تسوقي الآن واستفيدي من العروض والصفقات الرائعة.,Not Done
bath-scrubs,تسوقي أجود منتجات صابون الاستحمام عبر الإنترنت في الإمارات العربية المتحدة بأفضل الأسعار | نساء,دللي بشرتك بالرفاهية والنعومة من خلال شراء صابون الجسم من نساء عبر الإنترنت في الإمارات العربية المتحدة. ارتقِ بتجربة الاستحمام. اشترِي الآن لتنظيف منعش!,Not Done
scrubs-loofahs,تسوقي مقشرات الحمام عبر الإنترنت في الإمارات العربية المتحدة بأفضل الأسعار | نساء,أنعشي وقت استحمامك مع مقشرات الاستحمام من نساء عبر الانترنت في الإمارات العربية المتحدة وارتقي بروتين العناية ببشرتك. اشتري الآن للحصول على تجربة فاخرة ومنعشة!,Not Done
hands-feet,اشتري مقشرات الجسم واللوف عبر الإنترنت في الإمارات العربية المتحدة بأفضل الأسعار | نساء,دللي جسمك مع مستحضرات فرك الجسم واللوف من نساء لتجربة شبيهة بالسبا. دللي بشرتك بالرفاهية والفخامة. تسوقي عبر الإنترنت في الإمارات العربية المتحدة بأفضل الأسعار.,Not Done
hand-creams,تسوقي منتجات العناية باليدين والقدمين عبر الإنترنت في الإمارات العربية المتحدة | نساء,دللي يديك وقدميك مع منتجات نساء عبر الإنترنت في الإمارات العربية المتحدة بأفضل الأسعار. ارتقي بمستوى العناية بنفسك. اشتري الآن للحصول على بشرة جميلة!,Not Done
foot-creams,تسوقي كريمات اليدين عبر الإنترنت في الإمارات العربية المتحدة بأفضل الأسعار | نساء,غذي يديك بالنعومة من كريمات نساء لليدين عبر الإنترنت في الإمارات العربية المتحدة وارتقي بمستوى روتين العناية ببشرتك. اشتري الآن لأيدٍ ناعمة وجميلة!,Not Done
hand-foot-masks,تسوقي كريمات القدم عبر الإنترنت في الإمارات العربية المتحدة بأفضل الأسعار | نساء,دللي نفسك بالنعومة مع كريمات القدم من نساء وجددي شباب قدميك. تسوقي عبر الإنترنت في الإمارات العربية المتحدة واستمتعي برفاهية العناية الذاتية بأفضل الأسعار.,Not Done
eye-care,تسوقي أفضل أقنعة اليدين والقدمين عبر الإنترنت في الإمارات العربية المتحدة بأفضل الأسعار | نساء,دللي نفسك بأجود منتجات العناية الذاتية بيديك وقدميك من خلال استكشاف تشكيلة أقنعة نساء عبر الإنترنت في الإمارات العربية المتحدة وارتقي بأسلوب تدليل بشرتك. تسوقي الآن للحصول على بشرة ناعمة ومتجددة!,Not Done
under-eye-cream-serums,تسوقي منتجات العناية بالعيون عبر الإنترنت في الإمارات العربية المتحدة بأفضل الأسعار | نساء,ارتقي بروتين العناية بعينينك! استكشفي تشكيلة منتجات نساء للعناية بالعيون عبر الإنترنت في الإمارات العربية المتحدة، والمتاحة بأسعار مذهلة. تسوقي الآن للحصول على عيون جذابة وأكثر إشراقًا!,Not Done
eye-masks-1,تسوقي سيروم كريم تحت العينين أونلاين بأفضل الأسعار في الإمارات | نساء,غيري مظهر العيون المجهدة من خلال تشكيلة نساء من سيروم كريم لمنطقة تحت العينين على الإنترنت في الإمارات العربية المتحدة، بأفضل الأسعار. تسوق الآن للحصول على مظهر منعش وحيوي!,Not Done
lip-care,تسوقي أفضل أقنعة العين عبر الإنترنت بأفضل الأسعار في الإمارات العربية المتحدة | نساء,أنعشي عيناك المجهدتين مع أقنعة العيون من نساء عبر الإنترنت بأفضل الأسعار في الإمارات العربية المتحدة واحصلي على إطلالة متجددة. ارتقي بروتين العناية بعينيك الآن!,Not Done
lip-balm,تسوقي منتجات العناية بالشفاة عبر الإنترنت بأفضل الأسعار في الإمارات العربية المتحدة | نساء,دللي شفتيك بعناية! استكشفي تشكيلة منتجات نساء للعناية بالشفاه عبر الإنترنت بأفضل الأسعار في الإمارات العربية المتحدة. تسوقي الآن للحصول على شفاه ناعمة ومتألقة!,Not Done
lip-scrubs,تسوقي بلسم الشفاه أونلاين في الإمارات العربية المتحدة بأفضل الأسعار | نساء,جددي مظهر شفتيك مع نساء! تسوقي أفضل منتجات مرطبات الشفاه عبر الإنترنت في الإمارات العربية المتحدة وعززي روتينك للعناية بالشفاه. اشتري الآن للحصول على شفاه ناعمة ورطبة!,Not Done
lip-masks,تسوقي مقشرات الشفاه عبر الإنترنت بأفضل الأسعار في الإمارات العربية المتحدة | نساء,أعيدي الحيوية لشفاهك واستكشفي أجود منتجات مقشر الشفاه من نساء عبر الإنترنت في الإمارات العربية المتحدة لتحسين روتين العناية بالشفاه. تسوقي الآن للحصول على شفاه نضرة وناعمة!,Not Done
sun-care,تسوقي أفضل أقنعة الشفاه عبر الإنترنت بأفضل الأسعار في الإمارات العربية المتحدة | نساء,اكتشفي تشكيلتنا المتميزة من أقنعة الشفاه عبر الإنترنت في نساء الإمارات . تسوقي الآن واستفيدي من العروض والصفقات الرائعة.,Not Done
face-sunscreen,اشتري منتجات الحماية من الشمس عبر الإنترنت في الإمارات العربية المتحدة | نساء,احمي بشرتك مع منتجات نساء للحماية من الشمس عبر الإنترنت بأفضل الأسعار في الإمارات العربية المتحدة. ارتقي بروتينك اليومي للعناية ببشرتك. اشتري الآن للحصول على بشرة مشرقة ومؤمنة من أضرار أشعة الشمس!,Not Done
