URLs,Arabic Title,Arabic Desc,PR Status
kits-combos,تسوقي أجود أنواع كريمات الوقاية من الشمس عبر الإنترنت في الإمارات العربية المتحدة بأفضل الأسعار | نساء,احمي تألق بشرتك مع واقيات الشمس للوجه من نسا عبر الإنترنت في الإمارات العربية المتحدة وعززي من حمايتك من أشعة الشمس. اشتري الآن للحصول على بشرة مشرقة ومؤمنة من أضرار الشمس!,Not Done
facial-kits,تسوقي أفضل تشكيلات ومجموعات العناية بالبشرة عبر الإنترنت في الإمارات العربية المتحدة | نساء,جددي بشرتك مع تشكيلات ومجموعات نساء للعناية بالبشرة! تسوقي عبر الإنترنت في الإمارات العربية المتحدة بأفضل الأسعار. ارتقي بروتينك اليومي للعناية ببشرتك. اشتري الآن!,Not Done
combos-nysaa,اشتري مجموعات العناية بالوجه لبشرة متوهجة عبر الإنترنت في الإمارات العربية المتحدة | نساء,جددي روتينك مع مجموعات نساء للوجه. استمتعي ببشرة مشرقة خالية من العيوب مع عروضنا الحصرية عبر الإنترنت في الإمارات العربية المتحدة. ارتقي بنظام العناية بجمالك.,Not Done
gift-sets,اشتري مجموعات العناية بالبشرة عبر الإنترنت في الإمارات العربية المتحدة بأفضل الأسعار | نساء,اكتشفي جمال البشرة مع مجموعات نساء! اشتري مجموعات العناية بالبشرة عبر الإنترنت بأفضل الأسعار في الإمارات العربية المتحدة للارتقاء بروتين العناية ببشرتك. تسوقي الآن!,Not Done
skin-tools,اشتري هدايا العناية بالبشرة عبر الإنترنت عبر الإنترنت في الإمارات العربية المتحدة بأفضل الأسعار | نساء,ارتقِ بمستوى الهدايا مع أطقم هدايا العناية بالبشرة من نساء! اشتري عبر الإنترنت بأفضل الأسعار في الإمارات العربية المتحدة. امنحي بشرتكِ مظهراً متألقاً. تسوقي الآن!,Not Done
face-massagers,اشتري أدوات وإكسسوارات العناية بالبشرة عبر الإنترنت في الإمارات العربية المتحدة | نساء,ارتقي بروتين العناية ببشرتك باستخدام مجموعات وإكسسوارات نساء. اشتري أدوات تدليك الوجه وفرش التنظيف والمزيد بأفضل العروض. تسوقي الآن!,Not Done
cleansing-brushes,اشتري أفضل منتجات تدليك الوجه عبر الأنترنت في الإمارات العربية المتحدة بأفضل الأسعار | نساء,أعيدي الحيوية لبشرتك مع أجهزة وأدوات تدليك الوجه من نساء. تسوقي عبر الإنترنت للحصول على بشرة متألقة بأفضل الأسعار في دبي، الإمارات العربية المتحدة.,Not Done
rollers-gua-sha,اشتري أجود أنواع فرش التنظيف عبر الإنترنت في الإمارات العربية المتحدة بأفضل الأسعار | نساء,ارتقي بروتين العناية بالبشرة مع فرش التنظيف من نساء. اشتري أدوات العناية بالبشرة عبر الإنترنت في الإمارات العربية المتحدة، واستمتعي بمزايا التنظيف عالي الجودة. تسوقي الآن!,Not Done
dermarollers,اشتري البكرات وأدوات الغوا شا عبر الإنترنت في الإمارات العربية المتحدة | نساء,ارتقي بمستوى العناية ببشرتك مع بكرات الوجه وأدوات غوا شا من نساء عبر الإنترنت. استرخي وجددي نشاطك بأفضل الأسعار. تسوّقي عبر الإنترنت للحصول على أفضل عناية ذاتية.,Not Done
skin-supplements,تسوقي أفضل أدوات  ديرمارولرز عبر الإنترنت بأفضل الأسعار في الإمارات العربية المتحدة | نساء,عزّزي روتين العناية ببشرتك مع بكرات ديرما رولرز من نساء عبر الإنترنت. اشتري الآن في الإمارات العربية المتحدة، واستمتع بشحن مجاني.,Not Done
eyeliner,اشتري أفضل أنواع مكملات البشرة عبر الإنترنت بأفضل الأسعار في الإمارات العربية المتحدة | نساء,غذي بشرتك من الداخل مع مكملات نساء للبشرة. اشتري الآن لتعزيز روتين العناية ببشرتك بالمغذيات الأساسية بأفضل الأسعار. تسوقي للحصول على بشرة صحية ومتألقة!,Not Done
eye-pencils,الايلاينر  - تسوقي أروع تشكيلة ايلاينر عبر الإنترنت في الإمارات العربية المتحدة بأفضل سعر | نساء,تسوقي منتجات الآيلاينر عبر الإنترنت في نساء الإمارات . اختاري من بين أقلام الكحل أو الكحل السائل أو كحل الكاجال للحصول على إطلالة عيون تدوم طويلاً ومقاومة للبقع. استفيدي من العروض والصفقات الرائعة!,Not Done
eye-primer,تسوقي أقلام تحديد العيون عبر الإنترنت في الإمارات العربية المتحدة بأفضل سعر | نساء,هل تبحثين عن أقلام تحديد العيون عبر الإنترنت؟ استكشفي أقلام العيون الأكثر مبيعًا لدينا من أفضل العلامات التجارية. اشتري الآن بأسعار تنافسية.,Not Done
eyeshadow,برايمر العيون - تسوقي عبر الإنترنت في الإمارات العربية المتحدة بأفضل سعر | نساء,يهل تبحثين عن برايمر للعيون عبر الإنترنت؟ استكشفي تشكيلة برايمر العيون الأكثر مبيعًا من أفضل العلامات التجارية. اشتري الآن بأسعار تنافسية.,Not Done
eyes-makeup-remover,ظلال العيون - تسوقي عبر الإنترنت في الإمارات العربية المتحدة بأفضل سعر | نساء,اشتري أرقى منتجات ظلال العيون عبر الإنترنت في الإمارات العربية المتحدة من أفضل العلامات التجارية في نساء. استكشفي لوحات نابضة بالحياة لمكياج العيون وظلال العيون السائلة للحصول على إطلالات آسرة لعيونك. اطلبيها الآن!,Not Done
false-lashes,تسوقي مزيل مكياج العيون عبر الإنترنت في الإمارات العربية المتحدة بأفضل سعر | نساء,اشتري مزيل مكياج العيون عبر الإنترنت من نساء. اختاري من بين تشكيلتنا المتنوعة من منتجات إزالة مكياج العيون من أرقى العلامات التجارية واستمتعي بتجربة مثالية. اطلبيها الآن!,Not Done
mascara,تسوقي رموش صناعية عبر الإنترنت في الإمارات العربية المتحدة بأفضل سعر | نساء,هل تبحثين عن رموش صناعية على الإنترنت؟ استكشفي رموشنا الصناعية الأكثر مبيعًا من أرقى العلامات التجارية. اشتري الآن بأسعار تنافسية.,Not Done
bb-and-cc-cream,الماسكارا - تسوقي أرقى أنواع الماسكارا عبر الإنترنت في الإمارات العربية المتحدة بأفضل سعر | نساء,اشتري الماسكارا عبر الإنترنت بأسعار تنافسية من أفضل العلامات التجارية في نساء. لدينا تشكيلة من الماسكارا مثل الماسكارا السائلة وماسكارا الأقلام والجل والكريم وغيرها الكثير. اطلبيها الآن!,Not Done
blush,اشتري أجود أنواع كريمات الأساس وكريمات توحيد لون البشرة عبر الإنترنت في الإمارات العربية المتحدة بأفضل سعر | نساء,تسوقي للحصول على أفضل كريم أساس وكريم توحيد لون البشرة في الإمارات العربية المتحدة من نساء. احصلي على خصومات رائعة على كريمات الأساس وكريمات توحيد لون البشرة من أفضل العلامات التجارية للمكياج واستمتعي بخدمة التوصيل المجاني وعروضنا الرائعة.,Not Done
bronzer,تسوقي لشراء أحمر الخدود عبر الإنترنت في الإمارات العربية المتحدة بأفضل الأسعار | نساء,اشتري أحمر الخدود عبر الإنترنت بأفضل سعر من نساء. اختاري من بين تشكيلة واسعة من منتجات أحمر الخدود مثل أحمر الخدود الوردي واللامع والسائل. اطلبيها الآن!,Not Done
concealer-correctors,اشتري برونزر الوجه عبر الإنترنت في الإمارات العربية المتحدة بأفضل الأسعار |نساء,تسوقي من نساء للحصول على أفضل برونزر في الإمارات العربية المتحدة من نساء. احصلي على خصومات رائعة على مستحضرات البرونزر من أفضل العلامات التجارية للمكياج واستمتعي بخدمة التوصيل المجاني وعروضنا الرائعة.,Not Done
contour,اشتري أفضل منتجات الكونسيلر ومستحضرات إخفاء عيوب البشرة في الإمارات العربية المتحدة عبر الإنترنت بأفضل سعر | نساء,تسوقي للحصول على أفضل منتجات الكونسيلر في الإمارات العربية المتحدة من نساء. احصلي على خصومات رائعة على منتجات الكونسيلر من أفضل العلامات التجارية للمكياج واستمتعي بخدمة التوصيل المجاني وعروضنا الرائعة.,Not Done
face-palette,اشتري منتجات كونتور الوجه عبر الإنترنت في الإمارات بأفضل سعر | نساء,هل تبحثين عن أفضل منتجات الكونتور للوجه عبر الإنترنت؟ تسوقي أطقم الكونتور وباليتات المكياج والأصابع وبودرة تحديد الوجه الحصرية لدينا لنحت وتحديد وجهك. اطلبيها الآن!,Not Done
face-primer,"تسوقي باليتات مكياج الوجه عبر الإنترنت في الإمارات العربية المتحدة | نساء ",اشتري أفضل باليتات مكياج الوجه عبر الإنترنت من نساء من أشهر العلامات التجارية. اختاري من بين تشكيلة واسعة من باليتات المكياج، بما فيها كريمات الأساس والكونسيلر والبرونز وما إلى ذلك.,Not Done
foundation,اشتري مستحضرات برايمر الوجه عبر الإنترنت في الإمارات العربية المتحدة بأفضل الأسعار |نساء,البرايمر - تسوقي أجود مستحضرات برايمر الوجه عبر الإنترنت في الإمارات العربية المتحدة. اختاري من بين تشكيلة واسعة من كريمات التفتيح ومستحضرات التحكم في البشرة الدهنية ومكافحة التلوث وغيرها من منتجات البرايمر من نساء.,Not Done
highlighters,اشتري كريم الأساس عبر الإنترنت لجميع أنواع البشرة في الإمارات العربية المتحدة | نساء,تسوقي أفضل كريم أساس للوجه عبر الإنترنت في الإمارات العربية المتحدة من نساء. لدينا مكياج أساس لجميع أنواع البشرة، بما فيها البشرة الجافة والدهنية والحساسة. اطلبيها الآن!,Not Done
loose-powder,اشتري أقلام الهايلايتر عبر الإنترنت في الإمارات العربية المتحدة بأفضل سعر| نساء,تسوقي من نساء للحصول على أفضل أنواع الهايلايتر للوجه عبر الإنترنت من أرقى العلامات التجارية الشهيرة. استكشفي تشكيلتنا الواسعة من منتجات الهايلايتر بأصباغ معدنية ولامعة. اطلبيها الآن!,Not Done
makeup-remover,اشتري بودرة التثبيت السائبة عبر الإنترنت في الإمارات العربية المتحدة بأفضل الأسعار | نساء,تسوقي للحصول على أفضل أنواع البودرة السائبة في الإمارات العربية المتحدة من نساء. احصلي على خصومات رائعة على منتجات البودرة السائلة من أفضل العلامات التجارية للمكياج واستمتعي بخدمة التوصيل المجاني وعروضنا الرائعة.,Not Done
pressed-powder,تسوقي مزيلات المكياج عبر الإنترنت في الإمارات العربية المتحدة بأفضل سعر | نساء,اشتري مزيلات مكياج الوجه عبر الإنترنت من نساء. اختاري من بين تشكيلتنا الواسعة من مستحضرات إزالة المكياج لأرقى العلامات التجارية الموثوق بها للحصول على تجربة مثالية. اطلبيها الآن!,Not Done
setting-spray,البودرة المضغوطة - تسوقي أفضل أنواع البودرة المضغوطة عبر الإنترنت في الإمارات العربية المتحدة | نساء,اكتشفي تشكيلة البودرة المضغوطة من نساء للحصول على مكياج أساسي خالٍ من العيوب. تسوقي أجود أنواع البودرة المضغوطة المطحونة بدقة عبر الإنترنت للحصول على لمسة نهائية طبيعية تدوم طويلاً.,Not Done
tinted-moisturizer,اشتري بخاخ التثبيت عبر الإنترنت في دبي، الإمارات العربية المتحدة | نساء,تسوقي بخاخ التثبيت عبر الإنترنت في الإمارات العربية المتحدة من نساء واستمتعي بالانتعاش طوال اليوم وإطلالة خالية من العيوب. احصلي على خصومات رائعة على منتجات الكونسيلر من أفضل العلامات التجارية للمكياج. اطلبيها الآن!,Not Done
lip-crayon,مرطّب ملوّن للوجه - اشتري عبر الإنترنت بأفضل سعر| نساء الإمارات,احصلي على إطلالة لا تشوبها شائبة مع مستحضرات ترطيب الوجه الملونة من نساء. تسوقي عبر الإنترنت في الإمارات العربية المتحدة للحصول على أفضل منتجات تجميل الوجه. استكشفي تشكيلتنا واستمتعي بعروضنا الحصرية. اشتري الآن!,Not Done
lip-gloss,اشتري أقلام تلوين الشفاه عبر الإنترنت في الإمارات العربية المتحدة بأفضل الأسعار | نساء,تسوقي أقلام تلوين الشفاه عبر الإنترنت في الإمارات العربية المتحدة. تتميز أقلام تلوين الشفاه لدينا بألوان مذهلة تناسب شخصيتك. الإرجاع المجاني متاح مجاناً.,Not Done
lip-liner,تسوقي منتجات تلميع الشفاه عبر الإنترنت في الإمارات العربية المتحدة بأفضل سعر | نساء,هل تبحثين عن أجود منتجات تلميع الشفاه عبر الإنترنت؟ استكشفي تشكيلتنا من ملمعات الشفاه الأكثر مبيعًا من أفضل العلامات التجارية. اشتري الآن بأسعار لا مثيل لها.,Not Done
lip-oil,اشتري محددات الشفاه عبر الإنترنت في الإمارات العربية المتحدة بأفضل الأسعار | نساء,تسوقي محددات الشفاه من أرقى العلامات التجارية الأعلى تقييمًا بعروض رائعة - فقط على نساء. تتميز تشكيلتنا الواسعة من محددات الشفاه بألوان مذهلة تناسب شخصيتك.,Not Done
lip-plumper,زيت الشفاه المرطب - اشتري أجود أنواع زيت الشفاه المرطب عبر الإنترنت في الإمارات العربية المتحدة بأفضل سعر | نساء,اكتشفي تشكيلتنا المتنوعة من زيت الشفاه المرطب في نساء الإمارات عبر الإنترنت. عززي جمالك الطبيعي مع هذا المنتج المغذي والمرطب للشفاه. تسوقي الآن!,Not Done
lip-primer,أقلام نفخ الشفاه (بلمبر - اشتري أقلام نفخ الشفاه عبر الإنترنت في الإمارات العربية المتحدة بأفضل سعر | نساء,اكتشفي تشكيلتنا المتنوعة من أقلام نفخ الشفاه في نساء الإمارات. تسوقي عبر الإنترنت الآن واحصل على طلبك في غضون يوم أو يوميّ عمل. الإرجاع المجاني متاح مجاناً.,Not Done
lip-stain,أقلام نفخ الشفاه (بلمبر) - اشتري أقلام نفخ الشفاه عبر الإنترنت في الإمارات العربية المتحدة بأفضل سعر | نساء,اكتشفي تشكيلتنا الحصرية من برايمر الشفاه عبر الإنترنت في نساء الإمارات. عززي جمالك الطبيعي مع هذا المنتج المغذي والمرطب للشفاه. تسوقي الآن!,Not Done
lipstick,اشتري ملوّن الشفاه السائل عبر الإنترنت في الإمارات العربية المتحدة بأفضل سعر| نساء,استكشفي أفضل أنواع ملوّن الشفاه السائل على الإنترنت في نساء الإمارات. تسوقي من بين تشكيلة من ملوّن الشفاه السائل عبر الإنترنت للعثور على لونك المثالي. اطلبيه الآن!,Not Done
liquid-lipstick,أحمر الشفاه - اشتري أحمر الشفاه عبر الإنترنت في الإمارات العربية المتحدة بأفضل سعر | نساء,تسوقي أحمر الشفاه عبر الإنترنت في الإمارات العربية المتحدة من أفضل العلامات التجارية لدى نساء. اختاري أحمر الشفاه غير اللامع بألوان مثل الأحمر والوردي والنيود والكستنائي وغيرها الكثير!,Not Done
liquid-lipstick,تسوقي أحمر الشفاه السائل عبر الإنترنت في الإمارات العربية المتحدة بأفضل سعر | نساء,تسوقي أحمر الشفاه السائل عبر الإنترنت بأفضل الأسعار من نساء. اختاري أحمر الشفاه السائل بألوان مثل الأحمر والوردي والنيود والكستنائي وغيرها الكثير!,
